"DESCRIPTION","DURATION IN MS","NAME","PARENT SUITE","START TIME","STATUS","STOP TIME","SUB SUITE","SUITE","TEST CLASS","TEST METHOD"
"","10633","Increase counter when clicking the plus button","","2026-02-09","passed","2026-02-09","","","",""
"","1647","Success Path - User Lifecycle and Note Management","","2026-02-09","passed","2026-02-09","","","",""
"","8521","Verify counter stays at zero without interaction","","2026-02-09","passed","2026-02-09","","","",""
"","14652","Fail to complete product purchase due to missing mandatory details","","2026-02-09","passed","2026-02-09","","","",""
"","21808","Complete a product purchase with mandatory details","","2026-02-09","passed","2026-02-09","","","",""
"","232","Negative Path - Verify Duplicate Email Registration","","2026-02-09","passed","2026-02-09","","","",""
